{
  "$schema": "https://json-schema.org/draft/2020-12/schema",
  "$id": "https://plan.ai/generative-ui/schemas/surface.v1.schema.json",
  "title": "Surface manifest (frame.json)",
  "description": "The manifest an agent writes at artifacts/{agent}/{deck}/{surface}/v/{version}/frame.json. The path is the identity; agent/deck/surface/version are not repeated here.",
  "type": "object",
  "additionalProperties": false,
  "required": ["schema_version", "title", "alt_text"],
  "properties": {
    "schema_version": { "const": "generative-ui/surface.v1" },
    "title": { "type": "string", "minLength": 1 },
    "alt_text": { "type": "string", "minLength": 1 },
    "created_at": { "type": "string", "description": "ISO-8601 timestamp." },
    "backflow": {
      "type": "object",
      "additionalProperties": false,
      "properties": {
        "actions": { "type": "array", "items": { "type": "string" } }
      }
    },
    "handlers": {
      "type": "object",
      "description": "Sandboxed handlers keyed by backflow action. The server runs the matching handler when an interaction with that action arrives (opt-in via --enable-handlers). Handlers never edit the surface; they fold the backflow log into the surface's KV view.",
      "additionalProperties": {
        "type": "object",
        "additionalProperties": false,
        "required": ["lang", "entry"],
        "properties": {
          "lang": { "enum": ["js", "lua", "wasm"], "description": "Guest engine." },
          "entry": { "type": "string", "description": "Entry file relative to the version dir, e.g. main.js / main.lua / main.wasm." },
          "capabilities": {
            "type": "object",
            "additionalProperties": false,
            "description": "Default-deny: an absent field grants nothing.",
            "properties": {
              "http": { "type": "array", "items": { "type": "string" }, "description": "Allowed outbound HTTP hosts (exact match). Empty ⇒ no network." },
              "fs": { "type": "boolean", "description": "Read/write within the surface's jailed state/ dir." },
              "kv": { "type": "boolean", "description": "Read/write the surface's KV view." }
            }
          },
          "limits": {
            "type": "object",
            "additionalProperties": false,
            "description": "Hard limits enforced host-side, identically across engines.",
            "properties": {
              "wall_ms": { "type": "integer", "minimum": 0 },
              "mem_mb": { "type": "integer", "minimum": 0 },
              "http_calls": { "type": "integer", "minimum": 0 },
              "resp_kb": { "type": "integer", "minimum": 0 },
              "fs_kb": { "type": "integer", "minimum": 0 }
            }
          }
        }
      }
    },
    "nav": {
      "type": "array",
      "description": "Edges to other surfaces in the deck, by surface slug.",
      "items": {
        "type": "object",
        "additionalProperties": false,
        "required": ["to"],
        "properties": {
          "to": { "type": "string", "pattern": "^[a-z0-9][a-z0-9-]*$" },
          "label": { "type": "string" }
        }
      }
    },
    "metadata": {
      "type": "object",
      "description": "Free-form agent data — the only place unknown keys are allowed."
    }
  }
}
