{
  "schema_version": "generative-ui/surface.v1",
  "title": "Settings",
  "alt_text": "Dashboard settings form that persists and confirms what was saved",
  "created_at": "2026-06-27T10:00:00Z",
  "handlers": {
    "save": { "lang": "js", "entry": "main.js", "capabilities": { "kv": true } }
  },
  "nav": [{ "to": "sales", "label": "Back to Sales" }]
}
